{
  "schemaVersion": 1,
  "source": "mock",
  "server": {
    "id": "SERVER-01",
    "displayName": "SERVER-01",
    "status": "degraded",
    "cpuPercent": 18,
    "ram": { "usedGiB": 5.1, "totalGiB": 16.0, "usedPercent": 32 },
    "gpu": {
      "name": "GPU-0",
      "utilizationPercent": null,
      "memoryUsedGiB": null,
      "memoryTotalGiB": null,
      "temperatureC": null
    }
  },
  "experiments": [],
  "codexUsage": {
    "fiveHourPercent": 92,
    "fiveHourReset": "15:27",
    "weekPercent": 76,
    "weekReset": "9/19 16:09",
    "resetCards": 3,
    "providerStatus": "mock"
  },
  "freshness": {
    "server": { "state": "fresh", "ageSeconds": 0 },
    "codexUsage": { "state": "fresh", "ageSeconds": 0 }
  },
  "updatedAt": "2026-09-13T16:20:00+08:00"
}
